,code,signal_id,phase,target,label
110,an an am an an am an an an ao an an am am ao am am an an an an an an am am an an am an am am am an an ao an am an am an an an an am am am an an an am an am an am an an am am am am am an an an an am am am am an an an am am ao an an am ao am an an am an an an an an am an an an an am an am am am an an an am am am an am am am an am al an an am am an an an am an ao am am am am an an an am am al am am an am an al am an an an am am am an an am an am an am am an am an an an am am am am an an an an am an an an am an am am an an am ao am am am an an am an an an an an an am an am an am an an am an an an an am an ao an an am am,110,2,0,Não
318,bp bn bo bq bp bo bo bo bn bo bo bp bp bn bo bo bp bp bp bo bn bo bo bp bp bo bo bo bp bo bo bo bo bo bo bo bo bo bo bp bo bo bo bo bn bo bp bp bo bn bo bo bp bp bp bn bn bo bo bp bp bo bn bo bp bp bp bo bn bn bo bp bp bp bo bo bo bp bp bo bp bp bp bo bp bo bo bp bp bq bp bo bo bp bo bo bp bp bo bp bp bp bp bp bo bo bq bq bo bo bp bp bo bq bp bo bo bp bp bp bp bp bp bp bp bq bp bp bq bp bp bp bq bo bp bq bp bq br bq bo bp bq bp bp bo bq bp bq bq bq bp bp br bq bq bq bp bp bp bq bp bq bq bq bq bq bq bp bq bp bp bq bq bq bq bp bp bq bq bp bq bp bq br bq bp bq bq bq bp bq bq bp bq br bq bq bq bq br br br br bp bp bq bq,318,0,0,Não
429,cb ca bt bu bu cd ca bt bu cb cb bu cd cc ca cb bu cb cd ca ca bu cb cc cb bt ca cc bu ca ca cb bu bu ca ca cb bt ca cc bu bu ca ca cc ca bu cb cd cb bu ca cb cc cb ca cb cc ca ca cd cd cb ca cc cb ca ca cc ca cb bu bu cd cd cb bu bu cc cc cb bu ca cc ca cb cc cc ca cb ce ce bu bu cc cd cd cc bt cc cc ca cc ce cd bu bu bu cd cf ca bu cb bu ca ca cd cc bu bs cd cd bu cc cc ca cb cb cc cd cd ca ca cc ca cd cb ca ce cd bt bu ce cc bu bu cb cb bu ca cc ca cb ca ca ca cb bu bu cd cd bu bu bu ce cd bu cb cd cb ca cc cd ca ca cb cd cc ca cb cb cb cb bu bu cd cc bu ca cb bu bu bu cc cc ca bs ca cc ca cc ca ca cb cb cb cb ca,429,0,0,Não
29,bt bs bs bt bs bt bt bs bs bs bs bt bs bs bu bt bt bt bt bs bt bs bs bt bs bs bt bs bu bt bt bs bt bt bt bs bt bs bs bt bt bt bs bt bt bu bt bs bt bt bs bu bt bs bt bs bt bt bt bs bt bu ca bt bt bu bu bt ca bt bt bu bt bt bu bt bt bt bt bu bu bs bt bu bs bu bs bs bt bs bu bt bs bt bt bt bu bu bt bt bu bt bu bt bt bu bt bt ca bu bt bt bt bu bu bt bt bu bu bu bu bt bt bt bt bu bt bt bu bt bu ca bt bu bt bu bu bu bt bu bu bt ca bu bu bu bu ca bu bs bu ca bt bu bu bt bu bu bt bu bu bs bu bu bu ca bt bu bu bt bu bu bu bu bt bu ca ca cb bu bu bu cb bt bt ca bt ca ca bu bu bu bu ca bu bu bu bu bu cb ca bu bu bt ca bu bt ca,29,2,0,Não
438,be bf be be be bd bf bf be au be be be bf be bd be bd bf bf bf bd bd be bf be bf bf be bf be bg bf be be bf bd bf bg be bf be be bf be bf bf bc bf bg be be be bf bf be bf bg be bf bf bf bf bh be bf bf be bf bf be bf be be bf bf bf be be be bg bf bf be bf bf bf bf bf be be bg bf bg bf bf bf bf bf bg bg bf be bf bf bg bf bf bf bf bg bf be bf be bg be bf bg bf bf be bf bg bg bf bg bf bf bg bg bf bg bf bg bg bf bh bf be bg bf bf bg bf bg bd bg bg bf bf bg bg bf bh bg bg bg bf bf bg bg bh bg bf bh bh bg bh bf bg bh be bg bh bg bf bf bf bh bf bf bg bf bf bg bg bg bf bf bg bg bf bh bg bg bf bg bg bh bh bf bh bg bi bh bf bg,438,0,0,Não
444,ar aq ar aq ar ar aq ar as ar ar aq ar ar as as aq as as as as as aq aq ar ar aq as ar as ar as ar aq as aq as ar ar as as ar aq ar ar ar at ar ar aq as as at as aq ar ar as as aq ar ar as as ar as ar aq ar ar ar ar as ar ar ar as as ar ar ar as as at as ar ar as at as ar as ar as at ar ar ar ar as as ar ar as ar ar ar as ar as as as ar as ar ar as ar as as as as as at ar as at aq as ar as as as ar aq ar as as as ar ar as at as ar as ar as at as ar as ar ar as as as at ar ar as as as as as ar ar ar at ar ar as as at ar ar as ar as at at ar ar as ar as at as ar as as as as at as as as ar as as as as as ar as as ar as,444,0,0,Não
26,bk bk bk bk bl bj bi bk bj bk bk bk bk bk bl bl bk bk bj bj bj bk bm bk bk bk bk bk bk bk bk bh bk bk bl bk bl bl bj bl bl bk bk bk bk bk bl bn bk bk bk bk bl bk bk bl bk bm bl bl bk bk bk bl bl bk bk bl bk bl bl bk bk bj bk bk bk bl bl bk bl bl bl bk bk bk bk bk bk bm bl bl bm bk bk bk bk bl bk bk bl bl bl bl bk bk bk bk bk bl bk bl bm bk bm bl bl bl bl bl bl bl bl bl bl bl bl bk bl bj bk bl bl bl bl bl bl bl bj bk bk bk bl bl bl bl bm bl bl bk bk bl bl bl bn bk bm bm bl bm bl bl bm bk bl bl bm bl bm bk bl bm bk bk bl bk bm bl bl bm bk bl bl bl bl bl bl bm bn bm bm bm bl bm bl bl bn bm bl bk bm bl bl bl bm bk bk bl,26,2,0,Não
7,cb bs bs bs bs bu bs bt br bt bu bt bu bt ca bs bs ca bu ca bq bu cb bt bu bt ca bt bt bu bt ca bs bu bt bt ca br bt bt bu bt br bu bt bt br bu ca br bs bs ca bs br bt bs bu br bs bt bs ca bs bs bt bt bt bs ca bs bt br bt cb bq bs bu bu bs br bt bt bt bs bs bt br bt br bt bs br bs bq bu bt br bs bs bt br bs bt bt bs bq bt bt bt bt bs bu bq br bt bt ca bs bs br bt bt br bs bs bs bp br bu bt bs bq bs bs bq br br bs br br br br bs bp bs br bt bs bo br bq bs br br bu bq bp bq bt br bq br bq bs bq bq bt bq bs bq br bs br br bp bt bs br bq bq bt bp br br bs bs bn br br bs bq bq bs bq br bq br bs br bs bp bt bs bp br br ca,7,1,0,Não
454,bj bm bk bi bi be bf bi bh bf bh bg bf bg bi bh bi be bd bh bj bk bl bk bh bj bk bm bm bk bi bk bl bl bn bm bh bf bh bi bi bi bd be bf bf bh bi bd bc bd be bh bj bi bh bj bj bm bn bn bn bm bn bo br bp bo bn bn bn bo bm bl bm bk bj bj bj bg be bf be be bd bd be bg bf bf bg bf bi bj bk bj bl bm bm bp bo bo bn bn bn bo bo bo bo bn bn bm bn bl bk bf bf bg bg bg bf be bc be bd be bd bc bb bc bf bh bj bf bg bh bj bm bm bl bl bn bn bo bo bn bn bm bl bm bm bl bj bk bk bi bj bf bd be be be be be bc bd bc bc bd bd bd be bf bg bi bj bh bi bi bk bk bk bk bl bm bl bl bl bk bk bi bh bi bj bi bh bi bg bg bg bf bf bf be bd bf bg bg,454,1,0,Não
108,ce cf cd ce cc cc cd cc ce cg cb cb cc ce ce cc ca cf ce cb cb cc cf cd ca cc ce cc cb cd cd cc cb cc cf ce ca cb ce ce ce cc cb cd cd cd ce cc cd cd cc cd cf cc ca cd ce cc bu cb cd ce cb cb cd cc cb cc cc cc ca cc cc cd ce cc ca cd cf cd cb cb ce ce cc cc cd cd cc cb ce cc cb cc ce cc ca ca cc cd cd ca ca cc cb cc cc cb cb cb ca ce ce ca ca cc ce cd ca cb cf cd ca cb cc cc ce cb cc cc ca cc cd cb cb ca ca cd ce ca cb bu cc cd ca ca cb cb bu cc cd cb ca bu cc ce ca ca cc cc cc cb cb ce cd ca ca cb cc cc cb cb cc bu ca cd ce cb bt bu cb cd cc bu ca cb bu ca cc cc ca bt cb cd cc bu bt cd cd bu bu cb cd cc ca ca cb cb,108,0,0,Não
37,am am al al am an an am al am am am am am al al am am an am an am am am am am am am an an am am an am al an al am an am am an am an am am am an am am an am al an am al am an am al an an am an an an an an am am am an an am am an am am an am al an an aj al am am am am am am am am am an am an an am an an am al an an an am al an an am am am am am am an an an am al am am an am an am am an am am am an an am am am am am al an am am an an am am al am an am ak am am am an am al al am am an an am am am am am am am an an an an an am am an an am am am am al an an al am an an am am am am an an am am am am am am am am am an am an,37,1,0,Não
157,br bq bs br br bs br br bq br br br br bs bs br bs bs bs br br bt br br bs br br br bs bt br br bt bq br br bs br br bs bs br bs br br bq br br br bs bq bt br bs bs bs bs br br bs br bs bs bt br bs bs br bs bq bs br bq bs bs bs br bs br br bs br bt bq br bt br bt bs br bt br bt bs bt bs bs bt bs bt bs bt bt br bt br bs bs br bu br bs bt br bt bq bt bs bs bt bs br bs bs bt bs bt bs bs br bs bs br bs bs bs bs br bt bs br bt br bs br br bt bs bt bs bs bs bs bt br bs bs bs bt bs bt bs bt bt bs bt bs br bt bs bt bs bu bu bs bt bs bt bs bt bt bt bs bu bu bt bs bu bs bt bs bt bu br bu bt bu bt bs bu bs bs bt bt bu bs ca bt,157,1,0,Não
467,bu ca ca bu bu bu bu ca ca bt bt ca bu bu bu ca cb bu cb cb bu bt bu bu bu ca ca bu bu ca bu bu ca ca bt bt ca bu bu bu ca ca bt bu ca bt bu bu ca bu ca bt bu bt bu ca bu bu ca bt bt ca ca bt bu bu bu ca ca ca bt bu bu ca bu bu ca bs bu bu bu ca bu ca bu bt ca bu bu bu bu ca ca cb bu bt bu ca ca bu ca ca bt bu bt bu bt bu bu ca bu bu bt ca ca bu ca ca bu bt bu ca bu ca bu bt bu bu ca bu bu ca ca ca bu ca bu bt ca ca ca bu bu cb bt ca ca bu bu ca bu bt bu ca bu bu ca ca bt bs ca bu bu bu ca bu bu ca bu bt ca ca bu bu ca bu bu bu ca bu bu ca ca ca bt ca bt bt ca ca bu bu bu bu bt cb ca bu bt ca ca bu bu ca ca bu bu ca,467,2,0,Não
118,bs bs br bs bu br bs bs br bt bt bt bs bs bt bs bs bt bs bs bt bt bs bs bs bt bt bt bs bs bs bu bu bs bs bs bs bt bt bt bs bt bs bt bu bs bt bs bt bt bt bt bs bt bs bs bu bt bt bt bu bu bt bt bt bt bt bt bt bt bs bt bt bu bt bs bs bu bt bt bs bt bt bu bu bt bt bt ca bu bu bt bt bt bu ca bt bt bs bt bu bu bu bt bs bu bu bu bt bt bt bt ca bu bt bt bt bu bu bt bu bu bu bu bt bu bu bu ca bu bu bu bt bu bu ca bt bt bt bu bu bu bu bt bs bu bu bu bt bt bt bu bu bt bt bu bu bu ca bu bu bu ca bu bu ca bt bu ca ca bs bt bu ca bu bu bt bu bt ca bu bu bt bt bt bu ca ca bt bu bu ca ca ca bu bu bu bu ca ca bu bu bu ca ca bu bu ca,118,1,0,Não
114,bt bu bu bu bt bu bt bt bu bs bu bt bs bu bt bt bu bt bu bt bt bu bu bt bu bu bt ca bu bt bu bt bu bu bu bu bt bu bt bu bt bt bt bt bt bt bt bu bt bu bu bu bu bu bu bt bu bt bu bu bu bu bt bt bu bu bu bu bt bt bu bu bt ca bt bu bu bs bu bt bt bu bt bt bt bu bt bu bu bt ca bu bu bu bu ca bu bu bu bu bt bu ca bt ca bu bu ca bt bu bt bt bu bu bu bt bu bt bu ca bt ca bt bt bu bt bu ca bu bu bu bu bu ca bt ca bu bu ca bt bu bu bu bu bt bu bu bu bt bu bu bs bu bu bt ca bt bu bu bu bu bu bu bu ca bu bu ca bt ca bu bu ca ca bu ca ca bu ca bu bu ca bu bu bu bt ca bt bu bu bu bu bu bu bu ca bu bu ca bu bu ca bt ca ca bu ca bu,114,0,0,Não
175,ag af af ae ah ag ae ag ai ad ae ah ag ag af ae ah ag af af ag ag ae ad af ah ag ae af ad ai ag af af af af ag ag ag af ad ad ai ag ag af ad ah ah ag ah af af ae af ag ah ad ae ah af ag ae af ah ag ad ag ai af af ae af ah af ad ag ae ae af ae af ag ac ae ah af af ad ae ah ae ad ah af ac af ae af af ad ae af ae ad ad ad af ae ac af ae ac af ab ae af ab ac ae af ac ad ac ae ac uuu ae ae aa ae ac ad ae ad ae ae ac ab ad ac ae ac uuu ad ad ae ad ab uuu af uuu ab ae ac ab ac ab ab ae ab ab ad ab ab ac ab af ad uuu ac ac ad ac ab ad ad uuu ab af ac ab ab aa ae ad aa ad ae ab ab ac ad ad aa ac ad ab ad ab ab ae ad ab ae ag ab ad,175,1,0,Não
374,cf cg ce ce ce cf cd cf cd ce cg ce cg ce ce cf cf ce ce cd cj ce cd cb ce cc ce ce cd cd ce cd ce ce cg ci cj cg ce ce cd ce ch ci cd ci ch cd cf ch ce cg cc cf ca ch ch cd cg ce cl cf cf cg cf cj ce ck ce cd cg cb ce cf ck cf ca cf ce cf ce cd ce ce ch cd ci ce cb ce cb ca cg cf cf cc cj cd ci ch cd bs ce ce cf cg ce cd cd cg ci cb cd cd cc cf cd cg cd cd cf cf cg ca cc cb cc cl cd ca cd ca ci cd ch cg ce cf ck ci cd ce ce cg cj ce ch cd cg cd ce cf ce ce cd ce cc cd ci cj cg ci ce cc cc cd ch ci cg ce cg ci ce ce cd cf cc ce br ce ci cg cg cg cd cc cc cc cf cf cf cb ce cg ce cc cc cc ce cf ce cd ce cf ce cc cf bo,374,2,0,Não
181,ai ae ae aj ai al ah ai af ai aj af ak af ai ag ai aj ak aj ac aj ai ah ai af ag ah aj ai ak ah ad ai ag af ai ah ag ag ak ag ai ak af ah ag aj ah aj ai ai ak af ah ah ai ah ah ah af al ah aj ak af ah ai ah ag ak aj af aj ag ah aj ah ah af ah ah am aj ag aj ag ah ah ak ai ag ah af am aj ah ag ag ai aj al ag ai aj ag al ai ai ag ah ah aj am ag aj ai ae ak aj ai af ah ah ah am ah aj ag ai ah ag aj ag al ag ai ai ai aj ag ai ag aj ag ah al ai ak ak ai ah ai ak ah al ah ag al ai ak ai ai ag ah ah ag an ah ah ag ai al ai aj ad ai ah aj al aj aj af aj ai aj aj ae ah ai ak al ak ah af ak ah aj am ad ai ai ak aj ak ah af ak,181,1,0,Não
144,bg be be bf bf bg bg bf bf be bg bf bg bf bf bh bf bg be bf bg bh bi bd bf bf bf bg bg bh bd be bf bg bh be bg be be be be bg bf bg be bd bf be bg be bg be bd bf bd bg be be be be bf bc bf be bf be be bf bd be bf bf bg bd be bd bf bg be bg be bf be be bg bf bh bd bf bf bf bg bf bg be bf bg bf bh bf bg bg bf bg be bg bf bg bh bf bg be bh bf bf bg bf bg bf bg be bf bh bf bf bd bf bg bf bg be be be bf bg bd bf bd bf bf be be bc bf bf bf bf bd be bd bf bf be bf be be bd bf bg be bg be bf be be bg bf bg bd bf bf bf bg be bg bf bg bg be bg be bh bg bg bg be bg bg bi bh be bf be bh bf bh bh be bf be bg bf bf bg be bf bd bf,144,0,0,Não
370,ap an al ak am al am am ag aj ai al aj aj ad af ak ah ai ag ah af am ak ai aj ai an an am aj am an an aq am an ak an an ao an ah al al an am ah ag ai al aj al ah ae ai al al ak ak ai an an al am an am am an al al al al am an ak ah al ak am ak ag ah ak an ak ak af ak am am am al aj aj an al al ak aj ak am am ag al ai ak ak aj ai ai al aj an aj ai aj am an am al ai an an an an al al an ap an am ai aj al am ak ai ai af al al ak ah ak ai al am aj am al an an an an ak an an an an ak am an ao al al aj al am ak ak ai ah ah an aj ai ai ah aj ak am ah ak aj ak am am aj ak an an an an aj am am an al am aj an ao am al aj al am,370,1,0,Não
380,ak al al al al al al al al ak ak ak al am al al aj aj al al ak al ak aj aj am am al al aj am al ak am am aj am am am al al ak am am al am ak al ak al al an al ak ak am al al am ak al ak al al am al am ak am am ak al an an al an am am am al an an ak am an am am ak am al al ak an am al am ak ak an am al al al am am an an am am an am am am al ak am an am am an al al am am an am ak am an am al al am an ak al am al al am am an an am am an am al am am an an an al am an an an am am an al am an aj al an an ak al am am al al am al am am am al an al an an an am an an am an al an an an al an al am am am am al am an am ak am al,380,2,1,Sim
195,ar ar aq aq aq aq ar ar ar ar aq as ar ar ar aq ar ar as ar aq aq aq ar as as ar aq aq aq aq aq ar aq ar as as as at aq ar ar as ar ar ar aq as as as ar ar ar as ar ar as ar as as as as as as as as as as as ar ar at at at as as ar as at as at as as at at aq as aq ar as as at at aq as ar at as ar ar ar au at as as aq as as at at as ar ar as as as as aq as at at at ar au ar au as at at at at as at ar at at as at at at at at at as as as at at at ba at at as at at at au as at as as at at au at at at at au at as as as at at au at at at at at as as as at at au au at as as as at as as as at as as at as at at at at at at as,195,0,0,Não
405,ad ag af ag af ae af ac ac ag ag ac af ae ae af af ad ae ae af ae af ae ag af af ag ae af ad ag ag ai af ad ai ag ah ag ad ab af ah ae ag ad ad ae af af af af ac ag ah ae af ag af ad ag ad af ah ag ah af ag ah ah ae af ae ad ah ai af ag ad ae ag aj ac ad ae ad ai ah ag ab ah af ae ag af ae ad ah af ag af af ag ae ag ae ae ag ag ag ad af ae ag ah ae af ae ag af ah ae ac ah af af af ag ae ah aj ae ae af af ag ah ae ae ah af ah ag af ae ad ah ae ah ae ae ae af ah af ac ad ah ae ae ah af af ag ag ah ae ag ae ag af af ai ag ae ae ah ad ah ag ae ae af ag ae ah ag ae ab ad ah ag ag ae af ae ag ai af ag ac af ah ag ah ag ai,405,0,0,Não
275,bn bm bm bm bo bn bm bn bp bm bn bm bm bm bn bm bp bo bn bo bn bn bm bm bm bn bn bn bo bn bn bm bm bm bo bn bm bm bn bp bn bn bm bm bn bn bn bn bm bn bo bo bo bm bn bm bm bn bn bo bo bm bo bn bn bm bn bm bm bp bn bm bo bo bn bm bn bn bm bm bn bp bn bp bn bn bo bn bm bo bn bn bm bo bp bo bn bm bo bo bn bm bn bp bn bo bp bo bn bm bo bp bm bo bo bo bp bo bo bp bn bm bo bm bo bp bn bn bq bo bo bn bn bp bn bn bp bq bo bo bo bp bo bm bp bp bn bo bp bp bq bo bp bp bn bo bo bn bp br bo bp bo bp bp bn bp bp bo bo bq bq bq bo bp bq bp bo bp bp bp bq bo br bq bp bp bp bq bq bp bp bq bq bq bq bq bq bp bo br bo bp bp bp bs bq bp,275,2,0,Não
446,ca bu cb bu ca ca ca bu cc ca ca bu ca ca cb cb bu ca cb ca ca ca bu bu ca ca bu ca bu ca ca ca bu bu ca bu ca ca ca ca cb ca bu ca ca bu cc bu bu bu cb cb cb ca bu bu ca ca ca bu bu bu ca ca bu ca bu bt bu ca bt bu cb ca bu bu ca ca bu ca bu ca cb ca ca bt bu ca cb ca bu ca bu ca cb bu bu bu bu ca ca bu bu ca bu bu bu bu bu ca bu ca bu bu bu bu cb ca bu ca ca ca ca cb bt ca cb bt ca bu ca ca bu ca bu bu bt ca ca bt bt ca ca ca bu ca bt ca ca bu bu ca ca ca ca bu ca ca bu bu ca bu bu ca ca bu ca bu cb bt bt bu bu ca bu bt ca bu bu ca ca bt bu bu bu ca ca bu bu ca cb ca bu cb ca ca bu bu ca cb ca bu ca bu bu bu bu bu,446,2,0,Não
141,ap an ap am ao ap an ap am ap ao an ao an aq an ao ap am aq am aq ao an aq an aq an ao aq an ar an aq ao an ap an aq an ao ap an aq an ao an am ao an ap am ao ap an ap am ap am am ao ap ap an ao ap ao aq an ap an an ao an ap an ap ao ao aq ao ao ao ao ao ao ap ao ap ap ap ap ao ap ao ap ao ap ap ap aq ao aq ap aq aq ao ap ao aq ap aq aq ao aq ao ap ao ao aq an ap ao ap aq an aq ao ap ap ao ap am ar ap ap aq ao ar ao ap ao ao ap am aq ao ap ap ao aq an ap ao an aq am ap ao ap aq ao ar ao ar ao ao aq ao ar ap aq ar aq as ao ar aq ap aq ao ar ap ar ar aq ar ap aq aq ap ap ap ar aq aq aq aq ar aq aq ap aq ao aq aq aq as,141,0,0,Não
397,bi bj bj bi bj bk bj bi bk bk bj bi bi bl bj bj bj bj bj bj bm bk bi bj bj bl bk bk bk bj bj bl bl bl bi bk bj bi bl bj bk bj bk bk bj bk bj bk bi bk bk bj bj bj bk bj bk bj bj bi bj bj bi bj bk bj bj bi bk bk bi bj bj bj bi bj bj bh bi bj bj bj bi bi bj bj bk bk bj bj bi bl bk bj bj bh bk bj bk bk bh bk bj bl bl bi bk bh bk bl bk bk bj bj bk bj bl bk bi bi bk bl bj bk bj bj bj bj bk bk bj bk bk bi bk bj bk bk bj bk bi bk bk bi bi bi bl bk bj bj bi bj bj bj bk bh bi bk bj bl bh bj bi bh bl bj bj bi bi bk bj bl bj bi bk bj bl bi bi bj bj bk bl bj bk bi bk bk bj bk bh bk bk bk bm bl bj bk bi bl bj bk bk bg bk bk bl bk,397,1,0,Não
67,bu br ca bt bt ca bq bu bs bu ca br cc br bu ca bt cb bs ca ca bt cb bt bu bu bu cb bu ca bu bu bt cb bu bu bu bt cb bs cb bt bs cb bq cb bs bs cc bp cc br bt ca bo cc br bt ca bp cc bo bu bs bp cc bo ca br bp ca bp ca bq br bu bp ca bs bs bt bs bt bu bs bu bt bt ca bs cb bt bs cb bs ca bu bt cb br cb bt bs cc br cc bs bt ca bq cb bu bu cb bs cb bt bs cb bs ca ca bq cb bs bu ca bs cb br bt bt bq cc br bt ca bp cb bp bt bt bp cc bo ca br bp cb bp cb br br ca bo cb bq bt bu bq cb br bu bs bt bu br ca bs bt bt bu bu br cb br ca bt bs cb br cc bs bu ca bq cc br cc ca br cd bq cd bt bt cd bp cd bs bu cb bq cc bs ca ca br,67,1,0,Não
210,bg bf be bd bg bi bi bg bb bc bf bi bg bf bb uuu bn am aj bn ai as ooo ar al an bb ar ba bc at ar au au au bb au au bb bc be bg bf bg bh bg bj bg bd be be bc bd bg bc be bf ba bc bb ba bc bb bb ba bb at bb bc au bb ba bc bf be bd bf bi bh bi bg be bg bh bj bh bg bg bg bk bh bh bc bc bd bf bh bd bc as au bd be bc at at au bf bf be bd ba bc bg be be be bd bc bg bf bf bf bc bf bf be bd bd bd bd bf bb bc ba bc bd bc bc bb bd bc bd be bc bc bc bf be bg bg be bg bg bg bg be be bf bg be bf bg bd bf be be bd bf bf bc bd bd be be be bd ba bc bc bg bf be bc bd bf bg bf bd ba bc bd bf bf be be bb bd bg bf bd be bd bd bh bg bf be,210,0,0,Não
168,bt bt bs bq br bs bs bt bs bo bs ca bt bp bq bt bu bt br bs br bs bs bt bu br bq br bu bs br br bu bt bq bq bu bu bs br bp bs bs bt bt bs bq bp bs bu bu bp bp br bu bs bq br bs bt bs br bq bs bs bs br bt br bp bs ca bt bo br ca bu bp bq bu bs br br bs br bs bt bs bs bs br bs bt bu bq bo bu ca bt bo br bu bt br br bt br bs bt bt bt br br bs bt bu bp bq bu ca bq bo bt bt bs bp bs bu bq bs bs bu bp bq bt bu bs bo bq bt bt bs bp bq bt bs bs bq bt bs bt br bs bu bq br bt bu br bo bt ca bu bq bq bs bt bs br br br br bs bs bt br bo bs bu bt bn bq bu bu br bp bt bs bt bs bs br br bt bs bs bs br br bs bt br bp bs ca bt bo bp,168,0,0,Não
494,au ba bc ba au au ba bb au au at au bb ba ba au bb ba au bb au bb au au bb ba bb ba bb bb au bc au ba at ba bb bb bc at bb bb bb bb at bb ba bb ba au be ba bb bb ba bb at bc ba bb bb ba bd ba bb ba ba bd ba bb at bb bb au bb ba bc au at bc ba bb at au ba au bc au ba au au bb au ba as au bb ba ba at au ba bb ba at ba au au au au bc au ba at ba ba ba ba au ba au ba bb ba bb ba ba ba ba ba au bc ba ba ba bb bc au ba ba bb ba au ba ba bc bb ba ba ba ba ba ba ba au au au bb ba au au ba ba as au ba au au as ba au au at at ba at au at at ba at ba at au au as ba at au as au bb as au at ba ba as au at ba at at au au bb at at,494,2,0,Não
376,bp bp bq bt br bu bu bq bq bp bp bp br bs bs bq bq br br bq bo br bs bp bu bq bp br br bt bq bt br bo bn bp bu bu br bp bt bq bo br bp br bq br bt bq bs bq bp bq bp br bq bo bq bq br bs bs bq bq bq bq bo bp br bs bt br br br bo bo bq br bt br bq bq bp br bq bq bs bq bq bp bp br br br bt bq br bp bp bp bo bp br bs br bq bp bq bq bp bp br bu bq bo bs bo bq bp br bs bo bq bo bp br bu bt bq bo bp br bo bs bs bq bq bq bs bq bo br bp bq br br br bn bp bq br br bq bo bp bq bp bo bp bt br bq bq bp bq bq bo bs bt br bp bq br bo bq bs bq br br bq bs bp bp br bq bq bq br bp bo bq bp bp bs bs bp bp bp bq bq bq bs bt bq bo bn br,376,1,0,Não
414,am an am am ao am am an am am an an al am am an am an an al an am an an am am an am am an al am am ao am am am an am am ao an am am ao an an am am an an an am ao am an am an am an ao am ao an an an am am an ao am an am ao am an an an am am an an an an am an an an am am an am am an an an an am an an an an an am an am ao am an an am an an ao am am an ao an am am an ap an ao am an am an an an am am am an ap am am an ao an an an am an an ao am ao an an am an an an an al ao am ao am am ao am ao am ao an an an an an am an an an an ao an an am am am an an am an am an an ao an an an an an an an an an an ao ao an an an an am,414,0,0,Não
272,bu bt bu bu cb bu bu bs bu ca bu ca bu ca bs cb bu ca bu bu ca bu ca bu bu bu ca ca bu bu bu bu bt cb ca ca bu bt ca ca cb bu ca bu bu bu bu ca ca bq bt bu bt bu bt bt bu bu bu bt ca bu bu ca bu bu bt bu bu bu bu bt bu bt ca bu ca bt bu bt bt bu bu ca bs bu bt bu ca bt bu bt bu bt bu bu bu bt bu bu bt bu bs bu bu ca bu bt bu bt ca bu ca bu bs bu bt ca bu bu bs bu bu bu bt bt ca bt cb bu bt bt bt bu bt ca bt bu bt bt ca bu bu bt ca bt ca bu ca bt bt ca bu ca bt ca bt bu ca bt ca bu bu bs bt ca bu bu bs ca bt ca bu bu bu bt bu bt ca bt ca bs bu ca bu ca bt ca ca bu bu bu bu bs ca bt bu bt ca bt bu ca bt bt bs cb bt ca,272,2,1,Sim
109,ar ar aq aq ao ap ar ap ar at ao ao ap ar as ap an ar aq ao ap ap ar aq ao ap as aq ap aq aq aq ap ap as as ao ap ar ar as aq ap ar ar aq ar aq ar aq aq ar as aq ao aq as ar ao ap ar as ap aq aq ar aq aq ar aq ap aq ar ar as ar ap ar at as aq ap ar as aq ar as as ar ar as ar ap aq at ar ap ap ar ar at ap ao ar ar as ar aq ar ar ap at at ap aq aq at at ap ar au at aq ar ar as at ar as as aq as at ar as aq aq at au ar aq aq at as aq ar as ar aq ar at as aq aq as au aq ar as as as ar ar au au ar ar as at as ar as as aq ar at au as aq aq as au at aq ar ar as as at at as aq as at au aq ap au au aq ar as au au ar as as at,109,1,0,Não
248,bu bt bu cb bt bu bs bu bu bu cb bt bu bs cb bt bt ca bq cb bs ca bt bs ca br ca bt bt bs br bu bt br bu bq ca br bt br bp bt br bu bq bt bq br bt bq br bp bt bs br bt bq bq bs bs bs bp bs bq bs bt br bs bo bu br bt bs bq ca bp cb br bt bt br ca bs bt bt br bu bu bt bt br ca bs cb bs bu bs bt ca bs bu bq ca bs bu bu br bu bs bt br bq bs bs bt bt br bt bq bt br br bs bo bt bo ca br bq br bn bu bo bs bo br bs br bs br bo bs br br bq bo bs bp bu bq bs bq bs br bs bt bp bt bq bu bs bs bt br bu bs bs br bs bu bt bu bu br bt bs bu bu br bt bq cc bs ca bs br cb br ca bq bt bt br bt bs br bt br bu br br bs br bt bq bt bp br,248,2,0,Não
145,bf ba bd bd bf be bc bf bd bd bd bf bf bc be bf be bd bc be be bh bf bc bd bd bf be bg bf bc bd bc bh bf be be bd be bc be bf bf bf bc bd bd bd bf be bf ba bd bd bd bf bd be bb be bc bc be bd bf bb bd bd bb be bd bf bd bc bc bc bf bd be bd bd be ba bf be be be bc bd bb bf bf bf be bc be bb bf bg bd be bd bf bc bd bg be bg bd be bd be bf bd bg bd bd bd be bg bc bg be be bd bc bf bd bg bf bc bd bd bf bd bd bf bc bd bc bf bc bc bd bd bf bb bd bd bd be bc be bc be bd bc be bc be bd bd bd bb be bd bf be ba bd bd bg bc bc bd bd bf bd be bc bc be be bf bd bd bd be bh be bd bc bd bf be bg bd be bd bd bg bd bf bd be be bb bd,145,1,0,Não
92,aj ak aj aj al ak ak aj ai ak ak al al aj aj aj aj aj aj aj al aj ak al aj ak ai am ak ah ah aj al al ai aj ak aj ak aj ai ak aj aj ak al aj ah aj aj ak aj ah aj aj aj ai aj aj aj aj ak ak aj ah aj ak al ai ah aj ak al ai aj aj ai ai ak ak ak ai ah ai ak ak aj aj ak aj ai aj aj aj ai ai ak aj ai ah aj ak ai aj aj ai aj ai aj ak aj ai ak ak aj aj aj aj ak ak ah ah al al aj aj ai ak ai ai ak aj ah ai aj ak aj ah ah ai aj aj aj aj aj aj aj al ak aj ai aj ak ak aj ai al al ai aj ak aj ai aj ak aj aj ai al al aj ag aj ai ak aj ai ak aj ai ak ai aj aj ai ai al ak aj ak al am ak aj aj ak aj ak al aj aj aj ak al ak aj ai ak,92,2,0,Não
152,ae ae ag af ag ae ag ae ad ad ab af ad af ah ae af ad ag ab ac ae aa ae ad ae ae ae ae ad ae aa ab ad aa ae ae ad ae ad ae ac ae aa ac ad ab af ae ad ad af ae ad ae ac ac ad ae af af af af af af ae af ae ac ae af af ag ah af af af af ae ae af ad ae ae af ah ae ae ad af ac ae af ab ae ad ad ae ae af ae af ab ad ad uuu af ae ad ae ad af ac ag ad ac ad uuu af ac ae ae ad af ac af aa aa ac ab ag ad af ae ab af ad ah ac ac ad aa ag ae ah ah ae ah ad ag ad ag af ab ai af ah ah ag ag ae ag ad af ae ab ai ae ag ag af ad ac ah ab af ae ab af ad af ag af ac ad ag aa ad ae ab ae ae ad ad ae ad ae af aa ad ab ab ae af ae ac af ac,152,2,0,Não
368,bn bn bm bm bl bn bm bm bl bm bm bj bn bm bm bm bk bm bk bn bk bi bm bk bm bj bl bl bj bl bi bm bk bi bk bj bl bj bk bk bj bl bh bk bj bk bk bj bl bj bl bj bl bn bj bk bk bm bl bk bl bl bn bk bl bm bl bm bk bm bk bm bm bk bm bl bl bk bm bn bj bm bj bm bl bj bn bk bl bk bl bm bi bl bi bk bm bk bl bi bl bj bk bk bi bl bh bj bl bl bj bg bl bi bj bi bh bj bg bj bh bj bj bg bk bf bj bi bg bj bg bk bf bi bl bi bk bg bk bj bh bk bh bm bi bj bm bi bl bh bk bk bk bl bg bl bk bl bl bi bm bi bk bj bl bk bg bj bj bl bj bj bj bi bk bh bj bi bi bj bh bl bi bi bh bh bk bg bg bh bi bj bf bj bg bi bh bf bj bg bi bg bh bi bg bi bg bi,368,2,0,Não
