,code,signal_id,phase,target,label
468,bk bk bj bj bj bl bh bk bk bj bj bk bl bk bl bi bj bj bj bk bj bf bi bl bj bj bk bj bi bn bi bi bj bj bj bj bj bj bm bi bi bj bk bj bi bi bj bk bj bk bk bj bj bm bh bj bj bj bj bk bj bi bl bj bj bj bj bj bi bi bh bk bk bj bj bk bj bm bj bj bj bj bk bk bk bi bj bj bj bj bj bk bl bh bh bk bj bj bj bi bh bm bk bj bj bj bj bj bk bg bj bk bj bj bk bk bl bk bj bj bk bj bj bj bg bk bk bj bj bj bj bj bl bh bk bk bj bk bj bi bk bl bj bj bk bj bj bi bh bl bk bj bj bj bj bk bm bi bj bj bj bj bj bk bk bj bi bk bk bj bj bk bg bj bl bk bi bi bk bl bm bj bj bj bi bk bk bg bi bk bj bj bk bk bk bl bg bj bk bj bj bj bj bi bm bj bi bj,468,0,0,Não
83,ae af ad af af ad ad ad ad ae af ad ae ae ad ae ae ad ae ae ad ae ae af af ae ad ac ae ae ae ae ad ae af af ae ae ad ac ae ae ae af ae ad ae ae ae ad ae ac ae ad af ag af ad ad ae ae af ae ad ae af af ae ae ad ad ae ad ae af ae af af ae ae ae ad ae ae ac ae ae ae af ae ad ad ae ac ae ae ae ae ae ae ae af ae ad ad ac ad af af ae af ad ae af ae ad ad ad af ag ae ae af ae ad af ad ae ae ae af af ag af ae ad ad ae af af ae ae ad ag ag ae ad ac ad af ag ae af af ae ae ae ad ae ae ad ae ae ae ae ae ad ad ad ad ae af af af ag ae ad ae ae ae ae ad ad af af ag af ae ad ad ad ae af ad ad ae ae af ae ad ac ac ad ae ae af ae ag,83,2,0,Não
245,al aj aj am ak am al am ak ak al ak al aj an ak al al aj am ai al am ak al ah al ak ak am aj am ai ak am aj am ai al aj ak an aj al ah al ak ai ak ai al ai ak al ai ak ai ak aj ai am ah ak ai ak aj ai am ah al aj aj al ah am ak ak ak ai an ai ak aj ak am aj al aj aj aj aj an ah ak ak ai ak ai am aj ak ak aj ak ai al ak al ak ak al ai ak al aj al aj ak ai ai ak aj al aj ak aj ai ai aj al aj ak ai aj aj aj al ai ak aj ak ai ah aj aj ak ak al aj ah ak ai ak ak ai ak ah ak ai aj al ai am aj aj aj aj al ah am ai al ak ai al ai ak ak ak al ah am aj aj am ak an ai ak aj aj al aj am ah aj ak ai ak ag al ai ai al ag ak ag aj,245,2,0,Não
165,ae ag ai ag af af ah ah ae af ai ag af ad ah ag af af ag ag af ae ag ag ag ae af ag ag af ad af ah ag ad af ah ag af af ah ag af af ag ah ae ah ag af ah af ah ag ai af ae ai ah ag ae ag ah ae ag ag ai ah ae ag ag ag ag af ag af ag af ag ag ag af af ag ah af ae ah ah af ae ah ah af af ag ah ag ae ag ag ah ag af ah af ah ag ag ah ag ae af ai ah af af af ah af ag ah ah ae ae ah ah ah af ag ah ah ah af ah ah ag ag af aj ah ag ag ah aj ae ah ai ah ah ag aj ah ag ag ag ai ag af ag ag ai ah af ah ai ag ad ag ak ag af af ag ah af ag ag ag af af ai ag ag ag af ah ag af af ah ah af af ag ah ag ad ag ah ah ae ae ah ag ag af ag,165,0,0,Não
163,br br br bs bn br bp bq bq bs bs bs br bp bs br bq bq bs bo br bs bt bs bq bp br bt bo br bs bq bq bq bs ca bs bo br bq br bs bq bn bs bp bs bt bq bp bp br br br bp bs bq bq br ca bt bq bo bq bs bs bs bp br bq bq br bs br bq bq bq bt br bo br br bo bt bs bp br bq br br br bo br br br bq bp br bt bp bp bt bs bq bo bq bq bu bq br bq bq bq bt br bo bp bp bs br br bq bt bq bp bq bt bs bo bo bp bu bq bn br bq bq bq br bp br bp bq bs br bp bu bp br bs bp br bs bp bp bt bq bs bp bp bs br bn bs bt br bo bp br bs br bo bp br bq bp br br bq bq br bq bq bt bs bt bn bp br bo bp br br bq br bn bq bs bt bq bn bn bt bs bq bp bq bq,163,1,0,Não
199,bl bn bn bl bl bm bm bl bl bn bn bm bl bl bn bm bm bl bn bn bn bm bn bn bm bl bn bn bn bl bm bm bn bl bk bn bn bm bl bm bn bn bl bm bm bm bm bm bn bn bm bm bn bn bm bl bm bn bn bl bn bm bn bm bl bm bm bm bn bn bl bm bm bn bn bn bl bm bm bn bm bn bm bm bm bn bm bn bn bn bm bn bm bm bm bm bm bk bm bm bm bn bm bl bl bl bm bn bm bl bm bm bl bn bn bm bm bm bm bn bn bn bm bm bm bm bm bm bm bm bl bn bn bm bn bm bn bl bm bn bm bl bl bm bm bm bm bm bn bn bm bl bn bn bn bl bm bm bm bk bn bn bm bn bm bn bm bm bm bn bm bn bk bn bn bm bl bm bn bm bm bm bn bm bl bn bm bn bm bk bm bm bn bn bm bl bm bm bm bm bn bk bn bm bm bn bm bm,199,1,0,Não
228,bn bk bi bm bn bk bj bm bl bk bm bn bm bj bj bm bl bl bm bm bj bm bn bi bn bn bn bj bl bp bm bk bk bn bm bf bl bm bk bm bk bm bk bl bm bk bk bl bm bj bj bn bn bl bi bn bn bh bj bm bm bj bn bm bk bm bj bn bm bf bl bn bm bm bm bk bk bm bj bi bi bk bm bj bm bm bl bh bh bn bk bi bl bl bn bi bn bm bh bm bk bn bj bj bm bi bl bn bm bl bf bm bk bf bi bn bn be bm bn bm bk bh bo bh bh bm bm bn bi bp bj bg bm bj bl bk bm bn bi bl bm bl bg bn bo be bk bn bm bj bk bm bi bl bk bk bl bj bn bi bi bm bn bk bg bm bn bi bj bm bn bh bl bn bl bl bj bl bk bk bm bm bm bk bn bl bi bm bk bg bn bn bm bk bk bl bk bj bi bl bm bg bm bn bk bl bl,228,0,1,Sim
74,ao ap at bc aq ap ap ap as at as ap as ar ar ar aq aq ar ap as at as ar ar aq ar at aq as as ar aq ar ar as at ap aq as ar ar aq am as au as aq ao ap ar ba aq aq ap aq at as aq as ar ar at ar aq aq as ao as ar ar ar ar aq ar as aq as ar ap aq aq ap at aq ap aq as at ar ap an ar as at ar ao ao as as ar aq ap ap ar ar an aq aq aq aq ar ar ar ar ap aq aq ar ar as ar ar ap aq as ar aq ap aq ap as aq ao aq as at aq ao an aq as as ap ap ao au ar aq ap ap ar ar ar ao ap ap ar as ar aq ar ap ap ap ap aq as as ap ar ao aq ar as ap ap aq ap ar ao an ao as as au ao am ap ar ar aq aq an as aq ao ao ap aq as aq ap aq aq ar aq ap,74,2,0,Não
479,bm bn bo bm bn bn bm bn bn bn bo bm bm bm bm bm bn bn bn bn bn bn bm bm bm bn bm bn bn bn bn bm bn bm bm bo bn bm bm bn bn bm bn bm bm bm bn bm bn bm bn bm bn bm bm bm bn bm bm bn bn bn bn bn bn bn bn bm bo bl bm bm bm bm bm bn bm bm bm bn bm bm bm bm bm bn bm bm bn bn bn bm bn bn bm bm bn bn bm bm bm bm bm bn bn bn bm bn bm bm bm bn bn bn bm bn bm bn bm bn bn bm bm bm bn bn bm bm bm bn bn bn bn bn bn bl bn bn bn bm bl bm bn bl bm bm bn bm bl bm bn bm bn bm bn bl bm bn bm bn bn bn bn bm bn bn bn bn bl bn bm bm bn bn bm bm bm bm bm bn bm bn bn bm bm bm bl bn bl bm bm bn bn bm bl bm bm bn bn bm bn bl bn bn bn bm bm bl,479,2,1,Sim
358,bd be bb bc bc be bd bg bb bb bd bc be bc bd bc be bc bd bd bd bc bc bd bc be bb bc bd bc bd be bd bb bd bd bd bd bc ba bd bd bd bc bc bc bc bd bc bd bc ba bd bc bd be ba bc bc bd bd bd bc ba bc bd bd bc bb bb bb bc bd bc bc bb bc bd bb bg ba bb bc bb bd bc bc ba bc bd bc bb bc bb bd bb bc be ba bc bb bd bc be bc bb bc bb bc bc bb bc bd bc bc bb bb bc be bb bb bc bb bb bd bb bc bc bb bb bc bc bc bb au bb bc bc bc bc ba bb bd bb bd ba bb ba bc bc bb bd ba bb bc bc bc bc au bb bb bc bc bb bb ba bd bb bc bb bb bb ba bd bc bd ba ba bc bb bc bc au bb bb bb bc bb ba bc bb bc ba bc bb ba bb au bc bb bb ba bc bb bb bc au bb,358,1,0,Não
250,cf cf cd ce cd ce cg cc cd ce ce cg cg cf cc cf ce ce ch ce ce cf cf ce cg cd ca cd ce ce cf cc cc cd cf cg ce cc ca ce cf cf cf cd cd cd cf cf cf cd cc ce cg cg cg cg cc ce cf ce ce ce cc cc cf cd ce ce cc cc ce cd cd cf cd cd cf cf ce cf cc cc ce ce cf ce ce cd ch cf cg cf cc cd cf cg cd cf cd cd cf cf ce ce cc cc cg cg ce ce ce ce ch ce cd ce cd ce cf ch ce cf cc cd cg cf cf ce cd cd cg ch cf ce cc cc cf cg cf cf ce ce cf ci cg ce ce cc cg ch cg ce ce ce cf cg cf ce ce cd cg ch cf cf ce ce cf cg cf cf cg cd cg cg cf ce ce cc cf ci cf cf cg cf cg cg ce ce ce cd ce cg ch cf cg ce cf cg cg cf ce ce cf cj cg ce cf ce,250,1,0,Não
119,aj aj ai aj al aj aj aj aj ak ak ak aj ai ak aj aj ak aj aj ak al aj aj ak ak ak ak aj aj aj al ak aj aj aj aj ak ak aj aj aj ak ak al aj aj ai ak ak ak aj aj ak aj aj al ak aj aj al al aj ak aj ak ak ak aj aj aj ak aj ak aj ai aj ak ak aj aj ak ak ak aj aj aj ak am ak ak aj aj ak al am ak ai aj aj ak ak ak aj ai ak ak aj aj ak aj ak al ak ak aj ak ak aj aj ak ak ak ak ak ak aj ak al ak ak aj aj ak al ak aj aj aj aj ak ak aj ai aj ak ak al ak ai aj ak ak aj aj al ak ak ak ak aj ak am ak ak ak aj ak al ak aj aj ak al al ak aj ak aj al ak ak aj aj aj ak ak al aj aj ak al al ak ak ak ak ak al ak ak ak ak ak ak ak ak al,119,2,0,Não
310,bb ba bb bd bd bb bc ba ba bd be bd bb bc au bd be bc bb ba bb bd be bb bb bb bb bb bc bc bb bb bb bc bb bb bb bb ba ba bb ba bb bc bc ba bb ba bb bb bb bb ba ba ba bd bb bb bb ba au bb bc bc bc ba bb bb bc bc bd bb ba bb bc bd bd bd bb bb bb bd bd bc ba bb bc bd bf bd bb bb bc be bd bd bb bd bd bd bf be bc bc bd be be be bd bd bd bd be bd bb bc bc bc bd bc bb bc bc bb ba bb ba bc bd au bb bb bb bb bb bc bb bb ba bb be bc bc bb ba bc bd bd bc bc bb bb be bd bd bd ba ba bd be be be bc ba bd bf be bc bb ba bd be be bf bd bc bd bf bd bd bd bb bd be bf bf bd bb bc bd bd bd bd bb bc bf bd bd bc bb bc bb bb bc bd bb bc bd,310,1,0,Não
299,at ar as au bb as at au at as as at au au ar as ba ba at at at as au at at ba at as ba ba au at as at au au as ba au at at at au au at aq au ba at at at au ba at ar au bb at at au au ba ba at ba ba as as ba at bb au au au au at at bc at as at au bb au as as ba at as au au au at as au bc ba as as at ba bb at at bb au at ba bb at au au bb bc ba as au ba as ba au at au at at ba bb as at at at ba at at bb bb au at ba ba au at at ba ba at au bb bb au at ar ba bb au au ba au as ba ba ba au aq as ba bb au ba at au au au ba bb at as au bb bb ba at at bc au at ba bb ba at au bb bc at ar au bb ba au at at bb au at ba au at as,299,2,0,Não
255,bc bc au ba au ar au bb ba ar bb ba ba bb at ba as at bb ba as as bb bc ba ba at bb at ba at as bd bc at at bb bc ar au bb bb au at bd bb at au au au au ba au as ba ba ba at bb at ar bb bc bc as at bf au au au bb ba as ba bb bc at au bc ba ba au as bb ba ba as bb bb ba at au be ar at bb at ba ba au bc at at as bb ba au ba at bb ba au bc bb ba at au bb bc au as bd at au bb at bb au at ba au bc as au at au ba at au ba au at at bc ba as ar ba bc au au as bd au au ba at ba ar at bf at au at at bc au as as ba au au at au bb at as ba ar au at bb as au at as bc as as au ar bc ba at ba at ba at ba bc at ao as bd ba ar as as,255,0,0,Não
354,bk bj bi bj bj bj bj bi bh bj bj bj bj bk bh bj bj bj bj bj bi bi bi bk bk bk bj bj bj bj bk bj bj bi bj bj bj bk bk bj bi bj bj bk bk bj bh bi bi bj bk bk bj bj bk bi bj bj bi bi bj bi bl bk bk bj bi bi bj bj bh bj bj bi bi bj bj bj bk bi bi bj bj bj bj bi bi bj bj bj bj bj bi bj bh bi bi bi bj bj bj bi bj bi bi bj bi bi bi bj bi bh bi bi bh bj bj bi bi bi bh bh bi bh bh bj bh bi bi bi bh bi bh bg bi bi bi bh bh bh bh bi bh bi bh bh bh bh bh bj bh bg bh bi bi bi bh be bg bh bh bh bh bg bg bi bg bg bh bg bg bg bh bh bh bg bg bh bh bh bh bg bf bh bh bg bh bg bg bh bh bh bh bg bf bg bh bh bg bg bh bg bg bg bh bg bg bf,354,0,0,Não
400,an an am an an am am am an am an an an an am am an am an an an am am an al an an an an an am al am an an am am an an an am am al an am an an an an an an am am am am an am an an am am an an am an am an an an am an am an am an an an am am am an am am an am an am am am an am an am am am an al an an an am an am am am an am am am am am an an an an an am am am an an an an am am am an an an an an am an an am an am am am an an an an am al an an ao an an an ao am am am am an an am am am an am am an am an an am an an ao am am am an am an am am an am an an ao am an an an an am am an am an an am am am an an am am am an am an an,400,1,0,Não
225,cb ca bt cb cb bt bu bu cd bu bt cb bt cd bt cc bt bt cc bu cb bq cb cb bu bt ca cc br bt cc ca bu bt ca ca bt cc bt ca bt cb cc bs cb bt cd br ca cb bu bu bt cd bu bs bt ca cb bs bu cb bt ca bt cc bt bt cd bs ca bs cc bt bs cd ca ca bq cb ca bu ca bu ca bt bu cc bt bu bu ca bu br cd bt bu bu cb ca bq cb ca cb br bu cb bt bu bu cc bu bt ca cb bu bu bu cc bs ca bu bt bt ca ce br bt bt cc bu bs cc bu bu bs cc cb bt bu cc ca bu bt cb bu bu cc bt bu br cd bu bu bu ca cb bq cb cb cb bs bu cb bu bt bu cb ca bu bu bu bt ca bu cc bs bu ca ca bu bt ce br bu bu cd bu bs cd ca ca bt cb bu bt cb cb bt bu bu cb bt bu cd bt bu br,225,0,0,Não
353,bt bs bt bt bt bt bt bt bt bs bt bs bt bu bt bu bs bt bs bu bt bq bt bu bt bs bu bt bs bt bu bt bt bt ca bs br bu bu bu br bu bu bu bu bt bt bs bu ca bt bt bt bu bu bt ca bu bt bu bu bu bs bu bt bt bu bt ca bs bu bu bt bu bu bu bu bt bu bu bu bu ca bu bt ca cb bu bt bu bu bt bu ca bu bt bu ca bu bu bu bu bu bu bu bu bu bu bt ca bu bu bt bu ca ca ca bt ca ca bu bu ca ca bu bu ca bu ca bu bu bu bt bu ca cb bu bt ca bt bt ca bu bu bu bu bu ca ca bt bu ca ca bu ca ca bu bu bu bu bu bu ca ca ca bu bt ca ca bu bu ca bt bt ca ca bu bu bu bu bt ca bt bu bt bu ca ca bu bu bu bu bt ca ca bu bu bu ca bt bu ca bu bu bu bu ca bu,353,2,0,Não
234,bl bl bk bl bl bl bl bk bm bk bk bm bm bl bn bi bl bm bl bl bl bk bl bn bk bl bl bl bl bl bj bl bl bk bl bl bl bl bm bi bl bm bk bk bl bl bm bn bk bk bk bl bm bl bi bl bl bl bl bl bl bl bl bk bn bl bk bl bk bl bm bn bk bk bk bk bl bm bi bl bl bk bl bl bl bj bl bi bl bm bm bl bk bl bn bl bl bl bk bk bl bl bj bl bl bk bl bl bl bm bk bj bl bl bl bk bl bk bm bl bk bk bk bk bk bk bj bl bk bl bm bk bk bn bk bk bl bk bk bk bk bi bm bl bk bk bk bk bl bk bj bk bk bk bk bl bk bm bj bk bm bl bl bl bk bi bm bm bl bk bl bk bj bk bk bk bl bj bk bl bk bm bj bj bk bl bk bl bk bj bl bk bk bl bj bj bm bh bk bl bk bk bk bk bl bn bj bk,234,0,0,Não
383,cc ce cf ce cd ce ce ce ce cd cd cd cd ce ce cd cf cf ce cf ce cf cf ce ce cf ce cf cg cf ce cd cd ce cf cg ce cf cf cf cg ce cd cd ce cd ce ce cd ce ce cd cd cf cf ce ce cd cd cf cf cf cf cc cc ce cf ce ce ce cf ce cf ce cc ce ce cf cd ce cd cf cf ce cd cd ce cf cf cd cd cd cf cg cf ce cd cd cf cg ce cf cf cg ce cg ce cf cg ce ce cf cg cg cf ce cd cf cg cg ce cc cc cf cg cg cg cd cd cf cf cf ce cd ce ci cf ce cd ce ce ch cf cd cf cf cf cf ce cc cg ce ce cd cd ce cf cf cc cf ce ce ce ce cb ce cg cg cg cd cc ce cg cf cf cd ce cg ch cf ce cc ce ch ch cg cd ce ce ch cg ce ce cd ce cg cf ce cg cg ce cg cf cf cg ce cd ce,383,2,0,Não
274,bo bn bo bo bq bo bn bq br bo bm bn bo bo bo bn br bq bn bp bp bo bo bm bo bo bp bp bq bo bp bn bn bp bp bn bn bn bp bq bo bo bo bn bn bn bp bp bo bn bo bq bp bn bn bo bo bm bo bp bo bn bp bp bo bn bn bn bn bp bp bn bp bo bn bn bo bp bm bm bn bq bo bn bq bp bn bn bn bp bm bn bm bn bp bn bn bn bn bo bm bn bm bp bn bo bp bo bn bn bo bp bn bm bn bo bo bn bn bo bm bl bp bm bo bo bn bm bp bn bn bn bn bo bn bm bp bo bm bn bm bo bm bm bo bn bn bn bn bn bp bm bn bn bn bm bm bn bo bo bn bn bn bn bn bm bn bn bm bm bn bn bn bm bn bn bm bm bm bm bq bn bm bo bn bn bm bm bn bn bl bn bo bo bm bn bm bm bn bm bn bm bn bn bm bo bm bm,274,1,0,Não
36,bm bo bm bm bn bn bn bm bn bm bm bn bn bm bn bm bm bm bn bm bn bn bn bn bm bm bm bn bm bm bn bm bm bn bn bn bn bn bm bm bn bm bn bn bn bm bm bm bn bn bn bm bn bm bm bm bn bn bm bm bm bn bn bm bm bn bm bm bo bn bn bn bm bn bn bn bn bn bm bn bn bm bm bl bm bn bm bn bn bn bm bm bn bn bm bn bm bm bn bn bo bn bn bn bm bm bn bn bn bm bn bn bm bm bn bn bm bn bm bn bn bn bm bm bn bn bn bn bm bm bm bm bm bn bn bm bm bn bm bm bm bn bo bm bm bn bn bn bm bm bm bm bm bn bn bm bm bn bn bm bn bm bm bn bn bm bm bn bn bn bm bm bm bm bm bm bm bm bm bm bm bn bn bm bn bm bn bn bn bm bn bn bm bm bm bm bn bm bm bn bn bn bm bm bm bm bn bn,36,0,0,Não
196,bt bt bs br bs bs bt bs bs br bs bu bs bt bt bq bs bt bu bs br bs br bu bu bu bs br bs bt bt bt bt bs bs bu bu bu ca bs bt bs bu bt bt bs br bu bt bt bs bt bt bt bt bs bs bs bs bt bs bt bt bt bs bs bt bs bs br br bt bs bt br bs bs br bu bt bt br bs bt bs bq br br bs bt bt bs bs bp bs bs bt bs bq br bs bu bt bs bs br bs bs bt bs br bs br bt bu bs bs bq bt bs bt bt bs br br ca bt bt bt bs bu br bt br bs bs bs bs bs bs bt bs bs bs bs bs bs bs bs bu br bs bs br bt bs bt bq br bs br bs bs br br br bs bt bt bs br br bq bt bt bs br br bs br bs bs br br br bt bs bt bu br br bs bt bs br br bt bt bs bt bs bs bs bs bs bs bs bs,196,1,0,Não
139,ce cc cd cf ce cd cd cf cd cb cd ce cd cc cd cd ce cg cd cd cd cg ce cc ce cf cf cc cd cg ce cd cc cd ce cd ce ce cd cd cd ce ce cf cd cd cc cf ce cc cd cd cc cd cd cg cd cc cd cf cg cd cc cd ce ce cc ce cf ce cc cd cf cf cd cb ce ce cc ce cd ce cd cd ce ce cd cc cc ce cd ce ce ce ce cc cc cf ce ce cb cc ce cf cd cc ce ce cd cc cd ce cd cd cd ce cd cc ce cd cd cd cc ce cd ce cd cd cf cd cc cb cf cf cb cc cf ce cc cd ce cd cd ca ce cd cd ce ca cd ce ce cd cb cd cd cb cc ce cg cc cd cf cd cc cd cf ce cd cc cf cf cc cd cd ce cf cc ce cd cd ce cc cd cf ce cb cc cf ce cc ce ce cd cc cd ce ce cc cc cd ce ce ce ce ce ce cf,139,1,0,Não
365,bh bg bd be bc be bg bf bc bb bc bg bh bc bc bf be bd be bd be bd bc bd be bf be bc bc bf bf be bc bc bd be be bc be be bd bc be bd be bd bb bc be be bd bc au be bf bc bc bc bd bf bc bc be bc bd bc bd bb bd bc bb bc bd bd bc be ba be bf bb au bc bd be bd bb bc bb bc bd bd ba bc bb bc bd bd bc bb bd bb bd be bc bb bc bc bc bc bb bc bc ba bb be bb ba bb bb bc bb bb bb bb bb bd bb bb bb bb bc bc bb bb bb bb bb bb bf au bb bd au bb bc bb bb bd bc bc bc bb bb bb au ba bc bb ba at bc bd bd au bb ba bb bd bb au as bc bc bc bc bb bb bb au bb be bb au au bb bd bf bb bb au ba bc bc ba au ba bb bc bb bc bc ba au ba be ba au ba,365,2,0,Não
244,bg bd bf bg bg bg bf bi be bf bg bf bg be bj be bg bf be bh bd bg bg bf bg bc bh be bf bi be bg bc bf bf bf bh bd bg bd bf bh bd bg bc bh bf be bg bd bg be bg bg be bf be bf bf be bh bd bg be bh bg be bh bd bi bf bf bh be bi bg bh bg bf bj be bg bg bg bh bg bi bg bg bg bg bi bf bg bg bf bg bf bi bg bh bh bg bf bf bh bh bh bg bh bh bf bh bg bg bg bh bg bf bf bg bh bg bh bg bf bf be bg bh bf bh be bf bf bh bh bf bh bf bi bf be bg bg bi bh bi bg be bh bg bi bh bg bi be bi bg bi bi bg bk bh bh bg bh bi bf bk bg bk bh bg bj bg bj bh bi bj bf bj bh bh bj bi bk bf bh bg bh bj bh bj be bh bi bg bh bd bj bf bg bi bf bh be bh,244,1,0,Não
440,bt bu bt bt bt bs bu bu bs cb bt bt bu bu bu bu bt bt bu bu ca bs bs bt bu bt ca bu bt bu bu ca bt bt bt bu bs bu bu bt bt bt bt bu bt bu bu br bu bu bt bt bt ca bu bt bu bu bt bt bu bu bu cb bt bu bu bt ca bu bt bt bs bt bt bu bt bt bs bt bu bu bt bt bt bt bu bu bt bt bt bu bu bu bu bu bt bt bu bu bu bt bs bt bu bu bu bs bt bt bt bt bs bt bs bt bu bt bu bt bt bs bt bu bt bu bu bt bu ca ca bu bu bt bu bu bt bu bt bs bt bt bt bu bt bu bq bu bu bt bs bu bt bt ca bt bt bt bt bt bu bt ca bt bt bu bu bu bu bt bu ca bs bu bu bt bt bs bt bu bt bs bt bt bs bt bt bt bs bs bt bt bt bt bt bt bs bu bu bu bt bs bu bt ca bt bs bt,440,2,0,Não
286,bt bu ca bt bt bs bt bq bt bs bt bt bs bu bu bt bs bs bs bt bt bu bs ca bt bt bs bs bs br bs bt bt bu bt bt bt bs bt bs br bs bt bu bt bt bt bt bt bs bs bs bs bt bt bt bt bt bu bs bs bt bs bs bs bt bt bt bt bt bt bt bs bs bs bt bt bs bt bt bs bs bs bs bs bs bt bt bt bs bt bt bs bs bt bs bs bt bu bt bt bt bs bs bs bu br bs bu bs bt bt bt bs bs bs bs bt bs bt bt bt cb bt bt bt bs bt bt bt ca bt bs bt bt bs bt bs bs bt bt bt bu bt bt bt bq bs bs bs bs bu bt bu bu bt bs bs bs bt bt bt bt bt bt bu bt bs bt bs bt bs bu bt bu bt bt bt bt bs bq br bt bt bt bu bt bt br bu bs bs bt bt bs bt bu bu bt bt bt bs bt bs bq bs bt bu,286,1,1,Sim
59,bg bj bi bg bh bj bj bg bh bk bj bg bi bi bl bg bj bi bk bh bi bk bj bj bi bi bj bj bj bj bj bj bi bj bj bj bj bh bj bi bk bi bj bj bi bj bj bj bi bk bj bj bi bl bk bj bh bm bk bj bi bl bl bi bk bl bl bj bi bl bm bl bi bk bl bj bj bk bl bk bi bj bl bl bj bh bl bk bk bi bl bl bj bi bk bl bk bi bl bk bk bj bl bl bk bl bk bl bk bk bl bk bl bl bk bl bk bl bk bk bl bl bl bk bl bl bl bl bj bk bk bm bj bk bk bl bk bk bl bn bj bk bk bn bl bj bm bm bm bj bl bm bm bk bl bm bm bk bl bl bn bk bk bm bm bm bk bl bm bk bk bk bn bk bk bk bm bl bk bk bn bl bk bk bl bl bk bm bl bm bk bm bl bl bm bm bl bl bl bn bl bm bl bl bl bl bl bl,59,2,0,Não
111,bp bs bn bq bp bp bs bp br bp bq bq br bs bm bp bs bo br bq bt bp bo bs bq bq bq bs bp bp bq bt bt bo bq br bq bs bo bq br bp bs bq bq bq br bq bo bs bq br br br bu br bp bp bq bq bq bs bp br br bs bu bp bq bt bp br bp bu bs br br br bq bn bt bq bn bt br bs br br ca bs bp bq bt br bq bs bq cb bs bp bu br bt bq bq bt bq bs bs bu bt bq br bp bs bq bq bt bp br bq br bs bs bp bo bs br bt br bq cc bp bp bu bu bu bp bs bs bt bt bt bt bp bs bp bo bu bs bs bq bq ca bq bp br bu bo bm ca br br bq bs cc bm bp ca bq bq bt bu br bs bt bs bt bp bu br bn bt bu bs br bs bt br bp bo bu bp bo bt bq bt br bq bu bo bq bq bq br br br br,111,0,0,Não
89,ai aj ai aj aj ai ai ai ak aj ai aj aj aj aj aj aj aj ah ai ak ak aj aj ai aj aj aj ak ak ai ah aj ak aj ai aj aj aj ak ak aj ai ai ai aj ai aj aj ai aj aj aj aj aj aj ai aj ak aj ai aj ak aj ak ak aj aj ai aj ai aj aj aj aj ak ak aj ak aj aj aj aj ak aj aj aj aj ai aj aj ak ak aj ai aj aj aj aj aj ak aj al aj ak aj aj aj ai ak ak al ak aj ai aj aj ak ak ak aj aj ak ak ak aj ai aj ak ak ak ak aj ai ai aj al ak ai aj aj al ak ak ak aj ak ak ak ak aj aj aj aj ak ak aj aj ak ak aj aj ak aj aj al aj ak aj aj aj ak ak aj ak aj ak ak aj aj aj al aj ak ak aj aj ak ak ak ak aj aj aj ak ak ak ai aj ak ak al ak aj aj ak aj al,89,2,0,Não
437,bs bt bs bt bu ca bs bq bt bt bu bs bs bt ca br bs bu bt bt bs bu bu bs br bs bt bt bs bu bs bs bs bu bs bt br bs cb bs bs br bt bs bt bs bs bs br bt bt bu br bu bt bs bs bt bu bs br bp ca bt br bs bt bt bs bu bs bt bq br bt bt bt br bt bs br bt bt bu bs bp br bu bs bs bs bs bs bs bs bt br br bs bs bs bs bs bt br bs bt bs bt bp bt bu bs br bt bs bt bt br bt br br bt bu bs bq br bt bu br bt bs ca br bs bu bt bs br bu bs bu br bs bt br bt bt bt bs br bs bt bt bt bt bt bt br bt ca bs bt bs bs bt bs bt bt br br bs bu bt br bt bu bt bt bt bu bt br bs bu bt br bt br bu bs bs bt bt bs bs ca bs bs br ca bt bs br br bt bs bs,437,2,1,Sim
6,an al am al an an am am al an am am al am am aj am an ao am aj an am an ak am an al am ak am al am an ak an ak ak ak al am ak al al am al aj an al ak ai ak an aj am am an an aj al aj an an am am al an al an am am am ai an am ak am an ao al al al am an ak an am am am ak am ak an ak ak an aj ak ak an an ak am al an al aj an al am aj al am ak al al an am aj aj ak an al am al am al ai al am an aj ai al aj ak ak am an al al aj am aj aj am al am ak aj ak an am ak an an ak ai al an am an al al am ak an am an am ak am am an ak al an al am ah al am al am al am aj aj al ak am ai al ak al ak ak an al am ak aj am ak ak aj am am,6,0,0,Não
361,bq bo bq bp br bp bo bq bp bq bq bp bo bq bq bq bo br bp bq br bp br bo bq bq bp bp br bq br bo bq bq bp br bo bs bp bq bq bq bq bq bp br bq br br bp bs bp br br bq br bq br bq bq bq bq bq bs bo bs bp br br bo bt bo br bq bp bq bq br br bp bs bp bq bp bq bs bp br bq bq bq bp bq bq bq br bp bp br bp bq bq bq br bo bq bq bp br bp bs bq bp br bp br bp bq bs bp br bp bq bt bp bt bq br br bp bs bq bs br bq bs bq bq br bq bs bq br br bp br bq br bq br bq bt bp bs br br bs bq bs bp bs bq bp bs bq bq br bp bt bo br br bp bs bo bs bp bq bs bq bs bq bq br bq br bq br bt bp br bq bs bq bq bs bs br bq bq bp bs bq bs br br br bq,361,1,0,Não
346,au au au at at au ar au at at ar at au au ba as at as at ba au as as au as au ba at as at ba au at ar as at at au ba at as as at au au at at as at at at at at as at at au at as as at ba at au as at as au au as au as at au au as aq au as ba at at at as at at au as as as as au au at as as at at at at at at as au au at ar as au as au ba at ar at au au at ar as as at au at aq as ba au at as ar ar ar as at au ar as at at bb at as ar as at at au as as at at au as as at at au at at as as as as ba as at as at at at at aq as at at at au as aq au at at as as as at at as au at ar as at at at as as at as at at at ar as as as as,346,1,0,Não
338,bu ca cb cb cb cb ca bt ca cb bu cb cb ca cb cc cb bu ca ca cb cc cb cb bu bt ca cc cb ca ca bt bu ca cc cb cb ca bt cc ca ca ca ca bu cc cc cb cb ca ca cb cb cd cc cb ca ca cc cb cb cc cb cc cb cc cb cb cd cd cd ca cb bu ca cb cd cb ca cb ca ca ca cb bu ca cb cb cb ca ca ca bu cb cc cb ca bu cb cb cb cb cc cb bu cb cb cb ca cb cb cb cc ca ca bu ca ca cb cb ca ca bt ca ca cb cc cc ca ca cd cc cb cc ca cb cd ca cc cc ca cb cd cd cc cd cb cb ca cb cc ce cb bu cb ca ca cb cb ca cc cc bu cc cc cb cc cb cb cb cc ca cb cc ca cd cd ca cc cc cb cb cc cb cb cd cb cd ca bu ca cc cb cb cd ca ca cb ca cb cc cb bu cb cb ca cb cc,338,2,0,Não
158,ai ah al aj aj aj aj aj ai aj ak aj ak ak al aj aj al aj ak aj al ak aj al ak ak ak ak am aj aj ak ai ak aj al aj aj ak ak ak aj aj aj ai aj aj ak ak aj ak aj ak aj ak ak aj ak aj ak aj ak al aj ak aj aj aj ai aj aj aj aj ak ak aj ak aj aj ak ai al ai aj ak ak ak ak aj ak aj ak ak ak ak ak al aj al ak al ak aj al aj ak ak aj al aj aj al aj al ai al aj aj al aj ak aj ak ak aj al aj aj ak ai al aj ak ak aj ak ah ak aj ai ak ai ak ai ak aj aj ak aj ak aj ai ak ai ak ak ak ak aj al aj ak ak aj ak aj ak ak ak al aj al al aj aj aj ak ak al ak ak ak al al ak ak ak aj ak ak ak al aj al ak al ak aj al ak ak ak al al ak am ak,158,2,0,Não
150,bn bm bn bm bl bn bn bn bm bn bm bm bo bm bo bn bn bn bn bn bn bo bm bn bn bm bn bm bn bm bn bm bm bp bm bn bo bm bn bn bn bm bn bn bm bp bn bn bn bl bm bn bo bm bn bn bl bn bn bn bn bn bn bk bm bn bm bp bl bm bn bn bm bm bm bi bm bn bm bo bm bm bm bm bn bn bm bi bm bn bn bo bn bm bn bo bm bm bm bl bo bn bn bm bn bn bm bp bn bn bm bn bo bn bm bn bm bn bn bn bn bn bm bn bo bn bn bm bm bm bm bm bm bn bk bl bn bm bm bn bm bm bm bm bn bn bl bk bm bm bn bm bn bl bm bn bm bo bk bj bn bl bm bm bm bi bm bn bl bn bk bj bk bm bn bn bo bl bm bn bk bm bl bm bn bn bn bl bo bm bn bn bl bn bk bm bn bm bn bl bo bl bm bn bn bn bl bm,150,0,0,Não
177,au bb au ba as au as as bc ar at as as at at au ar as as aq as ar ar at as au as ar aq ar au as as au ar ar as at as au at as at as ar at as bb au as as as bb as ba ba at ba au au at ba bb at bd au at at at bd au bb at au bb at bc at au bb au bb as ba as at bc as ba as au as ar au ar ba at as ba ap as as at au ar as ao at at ar au ar at aq ar as ap au ar au at ap ar ap at au au au aq at ar as bc au ba at au at as ba au bb bc as at as ba bb ba bb as au as as bc au ba bb au au ar au as ba bb at au aq at au au ba as at ar aq at aq ba at at as ap as ap ba as ar at ao ap ap at at ar au an ar ap ao at ap au aq ar ar aq bc,177,0,0,Não
